"row_id","path","date","views","pathTail","story_id","headline","teaser","neutral","happy","sad","fear","anger","disgust","surprise","valence","primary_emotion"
"1469","/new-york/features/this-is-new-york/see-old-photos-of-your-neighborhood-with-this-interactive-map/","20150527","2277","see-old-photos-of-your-neighborhood-with-this-interactive-map","617482","See Old Photos of Your Neighborhood With This Interactive Map","<p>What did your place look like in the 20s or 30s?</p>","0.00","0.08","0.00","0.03","0.00","0.00","0.00","1","1"
"1471","/new-york/features/this-is-new-york/top-20-nyc-bar-names-according-branding-experts/","20150528","4759","top-20-nyc-bar-names-according-branding-experts","616239","The Top 20 NYC Bar Names, According to Branding Experts","<p>Did your favorite dive make the cut?</p>","0.00","0.03","0.03","0.01","0.01","0.03","0.01","-1","7"
"1472","/new-york/features/this-is-new-york/couple-leaves-note-asking-city-not-tow-their-car-as-wedding-present/","20150528","3773","couple-leaves-note-asking-city-not-tow-their-car-as-wedding-present","618565","Couple Leaves Note Asking City Not to Tow Their Car as a 'Wedding Present'","<p>An Uptown couple left their car parked on the street with a note asking that the NYPD only ticket them.</p>","0.00","0.25","0.23","0.11","0.11","0.11","0.04","-1","1"
"1473","/new-york/story/upper-east-side-roosevelt-island/upper-east-side/20-percent-of-eligible-kindergartners-didnt-get-gifted-talented-seat/","20150528","2715","20-percent-of-eligible-kindergartners-didnt-get-gifted-talented-seat","618540","20 Percent of Eligible Kindergartners Didn't Get Gifted and Talented Seat","<p>Roughly 20 percent of eligible students who applied to G&amp;T programs did not get offers, the DOE said.</p>","0.00","0.02","0.02","0.01","0.01","0.01","0.02","1","7"
"1474","/new-york/features/on-inside/nypd-fears-influx-of-grifters-targeting-rolex-wearing-victims/","20150528","2322","nypd-fears-influx-of-grifters-targeting-rolex-wearing-victims","617957","NYPD Fears Influx of Grifters Targeting Rolex-Wearing Victims ","<p>Grifters hit nightclub and bar scenes eyeing boozy victims sporting expensive watches last year.</p>","0.00","0.00","0.03","0.00","0.03","0.00","0.03","-1","7"
"1475","/new-york/story/harlem/central-harlem/cyclist-fatally-struck-by-car-being-chased-by-police-harlem-nypd-says/","20150528","2320","cyclist-fatally-struck-by-car-being-chased-by-police-harlem-nypd-says","618667","Cyclist Fatally Struck by Car Being Chased by Police in Harlem, NYPD Says","<p>Police chased the car after it ran a red light in The Bronx.</p>","0.00","0.09","0.10","0.04","0.10","0.01","0.04","-1","7"
"1476","/new-york/features/this-is-new-york/soak-views-of-manhattanhenge-from-queens-at-lichenge/","20150528","2197","soak-views-of-manhattanhenge-from-queens-at-lichenge","617996","Soak in Views of Manhattanhenge From Queens at 'LICHenge'","<p>The Hunters Point Parks Conservancy event will feature food, music and a contest for best sunset photo.</p>","0.00","0.53","0.18","0.00","0.18","0.00","0.18","1","1"
"1477","/new-york/features/apartmentality/how-french-dual-language-programs-public-schools-change-nyc-neighbohoods/","20150528","1528","how-french-dual-language-programs-public-schools-change-nyc-neighbohoods","617556","How Schools' French Dual-Language Programs Are Changing NYC Neighborhoods","<p>Carroll Gardens, Greenpoint and other areas attract families to their French dual language programs.</p>","0.00","0.12","0.09","0.00","0.00","0.00","0.00","1","1"
"1478","/new-york/features/on-inside/new-yorks-new-fbi-boss-was-once-queens-school-teacher/","20150528","1528","new-yorks-new-fbi-boss-was-once-queens-school-teacher","617560","New York's New FBI Boss Was Once a Queens School Teacher","<p>Diego Rodriguez taught in Jamaica before taking on criminals and rising through the FBI ranks.</p><p>&nbsp;</p>","0.00","0.08","0.00","0.00","0.00","0.05","0.00","-1","1"
"1479","/new-york/story/washington-heights-inwood/inwood/dyckman-street-laundromat-closing-make-way-for-another-restaurant/","20150528","1432","dyckman-street-laundromat-closing-make-way-for-another-restaurant","618461","Dyckman Street Laundromat Closing to Make Way for Another Restaurant","<p>Duce Laundry at 267 Dyckman St. will close in mid-June, building management said.</p>","0.00","0.03","0.00","0.00","0.00","0.00","0.01","-1","1"
"1480","/new-york/story/forest-hills-rego-park-jamaica/forest-hills/forest-hills-gets-ready-for-summer-concert-season/","20150528","1392","forest-hills-gets-ready-for-summer-concert-season","618657","Forest Hills Gets Ready for Summer Concert Season","<p>This year&rsquo;s concert series kicks off Thursday with a performance by Ed Sheeran.</p><p>&nbsp;</p>","0.00","0.08","0.00","0.00","0.00","0.00","0.00","1","1"
"1481","/new-york/features/on-inside/senate-passes-bill-restore-disability-pensions-new-nypd-officers/","20150529","11308","senate-passes-bill-restore-disability-pensions-new-nypd-officers","619065","Senate Passes Bill to Restore Disability Pensions to New NYPD Officers","<p>The bill seeking to reverse the reduction of disability pension will now go before the Assembly.</p><p>&nbsp;</p>","0.00","0.04","0.00","0.00","0.00","0.05","0.00","-1","5"
"1482","/new-york/features/this-is-new-york/couple-leaves-note-asking-city-not-tow-their-car-as-wedding-present/","20150529","4716","couple-leaves-note-asking-city-not-tow-their-car-as-wedding-present","618565","Couple Leaves Note Asking City Not to Tow Their Car as a 'Wedding Present'","<p>An Uptown couple left their car parked on the street with a note asking that the NYPD only ticket them.</p>","0.00","0.25","0.23","0.11","0.11","0.11","0.04","-1","1"
"1483","/new-york/features/this-is-new-york/williamsburg-pizzeria-sells-pizza-topped-with-more-pizza/","20150529","3504","williamsburg-pizzeria-sells-pizza-topped-with-more-pizza","619047","Williamsburg Pizzeria Sells Pizza Topped with More Pizza","<p>It&#39;s Pizza-ception! Or Cheese-ception or pizzapocalypse.</p>","0.17","0.00","0.00","0.00","0.00","0.00","0.00","0","0"
"1484","/new-york/features/this-is-new-york/nypd-officers-school-bronx-teens-on-basketball-court/","20150529","2916","nypd-officers-school-bronx-teens-on-basketball-court","619159","NYPD Officers School Bronx Teens on Basketball Court","<p>A pair of NYPD officers won against some Bronx kids in basketball when they took to the courts recently.</p>","0.00","0.10","0.00","0.00","0.10","0.00","0.00","1","7"
"1485","/new-york/story/harlem/central-harlem/10-new-restaurants-try-this-weekend/","20150529","2375","10-new-restaurants-try-this-weekend","616502","10 New Restaurants to Try this Weekend","<p>So many new places!</p>","0.00","0.00","0.00","0.00","0.00","0.05","0.00","-1","7"
"1487","/new-york/features/this-is-new-york/top-20-nyc-bar-names-according-branding-experts/","20150529","1966","top-20-nyc-bar-names-according-branding-experts","616239","The Top 20 NYC Bar Names, According to Branding Experts","<p>Did your favorite dive make the cut?</p>","0.00","0.03","0.03","0.01","0.01","0.03","0.01","-1","7"
"1488","/new-york/features/open-house-insider/open-house-agenda-3-apartments-see-this-weekend/","20150529","1908","open-house-agenda-3-apartments-see-this-weekend","641635","Open House Agenda: 3 Apartments to See This Weekend","<p>These units offer good looks, good value and a little something extra.</p>","0.00","0.75","0.06","0.60","0.53","0.53","0.09","-1","1"
"1489","/new-york/features/on-inside/nypd-fears-influx-of-grifters-targeting-rolex-wearing-victims/","20150529","1872","nypd-fears-influx-of-grifters-targeting-rolex-wearing-victims","617957","NYPD Fears Influx of Grifters Targeting Rolex-Wearing Victims ","<p>Grifters hit nightclub and bar scenes eyeing boozy victims sporting expensive watches last year.</p>","0.00","0.00","0.03","0.00","0.03","0.00","0.03","-1","7"
"1490","/new-york/features/get-out-do-this/14-things-do-manhattan-neighborhoods-this-weekend/","20150529","1669","14-things-do-manhattan-neighborhoods-this-weekend","643662","14 Things To Do In Manhattan Neighborhoods This Weekend","<p>This weekend&#39;s fun includes an ocean-themed carousel, fishing in the Hudson, and yoga in a mansion.</p>","0.00","0.75","0.04","0.04","0.04","0.04","0.00","1","1"
"1491","/new-york/features/this-is-new-york/how-volunteer-your-way-into-every-nyc-summer-festival/","20150530","2059","how-volunteer-your-way-into-every-nyc-summer-festival","619205","How to Volunteer Your Way Into Every NYC Summer Festival","<p>Hear good music, be helpful, save money. Win win win.</p>","0.00","0.75","0.05","0.00","0.05","0.00","0.05","1","1"
"1492","/new-york/features/on-inside/senate-passes-bill-restore-disability-pensions-new-nypd-officers/","20150530","1910","senate-passes-bill-restore-disability-pensions-new-nypd-officers","619065","Senate Passes Bill to Restore Disability Pensions to New NYPD Officers","<p>The bill seeking to reverse the reduction of disability pension will now go before the Assembly.</p><p>&nbsp;</p>","0.00","0.04","0.00","0.00","0.00","0.05","0.00","-1","5"
"1493","/new-york/features/this-is-new-york/williamsburg-pizzeria-sells-pizza-topped-with-more-pizza/","20150530","1467","williamsburg-pizzeria-sells-pizza-topped-with-more-pizza","619047","Williamsburg Pizzeria Sells Pizza Topped with More Pizza","<p>It&#39;s Pizza-ception! Or Cheese-ception or pizzapocalypse.</p>","0.17","0.00","0.00","0.00","0.00","0.00","0.00","0","0"
"1494","/new-york/story/washington-heights-inwood/fort-george/liquor-license-denied-for-uptown-bar-where-police-were-assaulted/","20150530","1346","liquor-license-denied-for-uptown-bar-where-police-were-assaulted","618814","Liquor License Denied for Uptown Bar Where Police Were Assaulted","<p>CB12 voted against a liquor license renewal for St. Nicholas Avenue bar&nbsp;Lucky Seven.</p>","0.00","0.20","0.00","0.00","0.00","0.00","0.00","1","1"
"1495","/new-york/features/this-is-new-york/nypd-officers-school-bronx-teens-on-basketball-court/","20150530","1333","nypd-officers-school-bronx-teens-on-basketball-court","619159","NYPD Officers School Bronx Teens on Basketball Court","<p>A pair of NYPD officers won against some Bronx kids in basketball when they took to the courts recently.</p>","0.00","0.10","0.00","0.00","0.10","0.00","0.00","1","7"
"1498","/new-york/story/upper-east-side-roosevelt-island/upper-east-side/video-mta-simulator-lets-you-drive-second-avenue-subway/","20150530","710","video-mta-simulator-lets-you-drive-second-avenue-subway","619151","VIDEO: MTA Simulator Lets You Drive the Second Avenue Subway","<p>The simulator includes a &quot;passenger mood&quot; barometer that changes&nbsp;depending on the conductor&#39;s driving.</p>","0.00","0.00","0.00","0.02","0.00","0.00","0.00","-1","7"
"1499","/new-york/story/harlem/central-harlem/10-new-restaurants-try-this-weekend/","20150530","671","10-new-restaurants-try-this-weekend","616502","10 New Restaurants to Try this Weekend","<p>So many new places!</p>","0.00","0.00","0.00","0.00","0.00","0.05","0.00","-1","7"
"1500","/new-york/features/this-is-new-york/couple-leaves-note-asking-city-not-tow-their-car-as-wedding-present/","20150530","609","couple-leaves-note-asking-city-not-tow-their-car-as-wedding-present","618565","Couple Leaves Note Asking City Not to Tow Their Car as a 'Wedding Present'","<p>An Uptown couple left their car parked on the street with a note asking that the NYPD only ticket them.</p>","0.00","0.25","0.23","0.11","0.11","0.11","0.04","-1","1"
"1501","/new-york/features/this-is-new-york/how-volunteer-your-way-into-every-nyc-summer-festival/","20150531","1469","how-volunteer-your-way-into-every-nyc-summer-festival","619205","How to Volunteer Your Way Into Every NYC Summer Festival","<p>Hear good music, be helpful, save money. Win win win.</p>","0.00","0.75","0.05","0.00","0.05","0.00","0.05","1","1"
"1502","/new-york/features/this-is-new-york/what-could-we-have-expected-yelp-reviews-of-penn-stations-restaurants/","20150531","1018","what-could-we-have-expected-yelp-reviews-of-penn-stations-restaurants","618023","Yelp Reviews of Penn Station's Restaurants Are Hilarious","<p>If you must eat at Penn Station, don&#39;t get your hopes up too high.</p>","0.00","0.60","0.02","0.01","0.01","0.01","0.02","1","1"
"1503","/new-york/story/washington-heights-inwood/fort-george/liquor-license-denied-for-uptown-bar-where-police-were-assaulted/","20150531","844","liquor-license-denied-for-uptown-bar-where-police-were-assaulted","618814","Liquor License Denied for Uptown Bar Where Police Were Assaulted","<p>CB12 voted against a liquor license renewal for St. Nicholas Avenue bar&nbsp;Lucky Seven.</p>","0.00","0.20","0.00","0.00","0.00","0.00","0.00","1","1"
"1504","/new-york/features/this-is-new-york/williamsburg-pizzeria-sells-pizza-topped-with-more-pizza/","20150531","811","williamsburg-pizzeria-sells-pizza-topped-with-more-pizza","619047","Williamsburg Pizzeria Sells Pizza Topped with More Pizza","<p>It&#39;s Pizza-ception! Or Cheese-ception or pizzapocalypse.</p>","0.17","0.00","0.00","0.00","0.00","0.00","0.00","0","0"
"1506","/new-york/story/washington-heights-inwood/inwood/crime-spikes-upper-manhattan-for-third-month-row/","20150531","687","crime-spikes-upper-manhattan-for-third-month-row","618908","Crime Spikes in Upper Manhattan for Third Month in a Row","<p>Crime rose 15 percent in the last 28-day period compared to the same time last year.</p>","0.00","0.00","0.08","0.08","0.30","0.00","0.00","-1","7"
"1508","/new-york/story/upper-east-side-roosevelt-island/upper-east-side/video-mta-simulator-lets-you-drive-second-avenue-subway/","20150531","657","video-mta-simulator-lets-you-drive-second-avenue-subway","619151","VIDEO: MTA Simulator Lets You Drive the Second Avenue Subway","<p>The simulator includes a &quot;passenger mood&quot; barometer that changes&nbsp;depending on the conductor&#39;s driving.</p>","0.00","0.00","0.00","0.02","0.00","0.00","0.00","-1","7"
"1509","/new-york/story/midtown-theater-district/midtown/seven-people-injured-after-crane-collapses-midtown/","20150531","477","seven-people-injured-after-crane-collapses-midtown","619643","Ten People Injured After Crane Drops Load in Midtown, Officials Said","<p>The crane was lifting a&nbsp;23,000 pound air conditioner on&nbsp;Sunday morning at 261 Madison Ave. when it fell.</p>","0.00","0.50","0.45","0.11","0.00","0.11","0.14","-1","1"
"1510","/new-york/story/washington-heights-inwood/washington-heights/12th-annual-uptown-arts-stroll-kicks-off-this-weekend/","20150531","477","12th-annual-uptown-arts-stroll-kicks-off-this-weekend","619346","12th Annual Uptown Arts Stroll Kicks Off This Weekend","<p>This year the festival will expand to include West Harlem for the first time.</p>","0.00","0.04","0.05","0.00","0.00","0.00","0.00","-1","2"
"1511","/new-york/features/this-is-new-york/5-cars-that-live-better-than-you-nyc/","20150601","3814","5-cars-that-live-better-than-you-nyc","618873","These 5 Cars Have a Better Life Than You ","<p>These cars live in garages with river views, chandeliers and private elevators.</p>","0.00","0.00","0.00","0.00","0.03","0.00","0.00","-1","7"
"1512","/new-york/story/washington-heights-inwood/inwood/nypd-makes-first-arrest-using-tablet-computer-under-new-program/","20150601","3669","nypd-makes-first-arrest-using-tablet-computer-under-new-program","619001","NYPD Makes First Arrest Using Tablet Computer Under New Program","<p>The 34th Precinct was able to arrest two phone thieves using a newly issued tablet, police said.</p>","0.00","0.04","0.00","0.00","0.00","0.05","0.00","-1","5"
"1513","/new-york/story/rockaways/breezy-point/2-men-flung-from-stolen-car-breezy-point-crash-nypd-says/","20150601","3350","2-men-flung-from-stolen-car-breezy-point-crash-nypd-says","619672","2 Men Flung From Stolen Car in Breezy Point Crash, NYPD Says","<p>Four men took the BMW for a joyride and crashed it into a hydrant, police said.</p>","0.00","0.00","0.02","0.04","0.30","0.30","0.00","-1","7"
"1514","/new-york/story/woodlawn-wakefield/edenwald/substitute-teacher-fired-for-asking-4th-graders-for-dating-advice/","20150601","2728","substitute-teacher-fired-for-asking-4th-graders-for-dating-advice","522472","Substitute Teacher Fired for Asking 4th Graders for Dating Advice","<p>Cassandre Fiering asked children to help her choose between two men, she admitted.</p>","0.17","0.00","0.00","0.00","0.00","0.00","0.00","0","0"
"1515","/new-york/story/murray-hill-gramercy-midtown-east/kips-bay/city-move-teens-out-of-troubled-acs-shelter-park-slope-space/","20150601","2418","city-move-teens-out-of-troubled-acs-shelter-park-slope-space","617101","City to Move Teens Out of Troubled ACS Shelter to Park Slope Space","<p>ACS plans to relocate 12 teens from its Manhattan&nbsp;Children&#39;s Center starting in June, officials said.</p>","0.00","0.23","0.11","0.19","0.10","0.00","0.10","-1","1"
"1516","/new-york/story/astoria-long-island-city/astoria/quiz-how-well-do-you-know-astoria/","20150601","2143","quiz-how-well-do-you-know-astoria","617108","Quiz: How Well Do You Know Astoria?","<p>Test your knowledge of the neighborhood with our quiz.</p>","0.00","0.07","0.53","0.26","0.26","0.26","0.00","1","2"
"1517","/new-york/features/this-is-new-york/fort-greene-biergarten-welcomes-moms-breastfeed-at-bar/","20150601","2133","fort-greene-biergarten-welcomes-moms-breastfeed-at-bar","618395","Fort Greene Biergarten Welcomes Moms to Breastfeed at the Bar","<p>&quot;We have so many young mommies as regulars, so it just made sense,&quot; owner Tobias Holler said.</p>","0.00","0.08","0.15","0.00","0.03","0.15","0.00","-1","7"
"1518","/new-york/story/bedford-stuyvesant/bed-stuy/video-bystander-wounded-bed-stuy-shooting-nypd-says/","20150601","1774","video-bystander-wounded-bed-stuy-shooting-nypd-says","619687","VIDEO: Bystander Wounded in Bed-Stuy Shooting, NYPD Says","<p>The man was hurt when a gunman opened fire during a drug-related dispute, police said.</p>","0.00","0.00","0.75","0.04","0.05","0.00","0.14","-1","7"
"1519","/new-york/story/chelsea-hells-kitchen/hells-kitchen-clinton/watch-mta-workers-train-for-upcoming-opening-of-7-train-extension/","20150601","1747","watch-mta-workers-train-for-upcoming-opening-of-7-train-extension","619715","WATCH: MTA Workers Train for Upcoming Opening of 7 Train Extension","<p>Operators have begun&nbsp;training at the new Hudson Yards station.</p>","0.00","0.00","0.00","0.00","0.03","0.05","0.00","-1","7"
"1520","/new-york/story/midtown-theater-district/midtown/rains-flood-warning-continue-into-tuesday-forecasters-say/","20150601","1699","rains-flood-warning-continue-into-tuesday-forecasters-say","619677","Rains and Flood Warning Continue Into Tuesday, Forecasters Say","<p>&quot;We&rsquo;ll be wet basically through Tuesday late in the day,&quot; forecasters said.</p>","0.00","0.05","0.05","0.00","0.05","0.00","0.05","-1","7"
"1522","/new-york/story/woodlawn-wakefield/edenwald/substitute-teacher-fired-for-asking-4th-graders-for-dating-advice/","20150602","9288","substitute-teacher-fired-for-asking-4th-graders-for-dating-advice","522472","Substitute Teacher Fired for Asking 4th Graders for Dating Advice","<p>Cassandre Fiering asked children to help her choose between two men, she admitted.</p>","0.17","0.00","0.00","0.00","0.00","0.00","0.00","0","0"
"1523","/new-york/features/this-is-new-york/goodbye-farrells-beloved-styrofoam-cups/","20150602","4814","goodbye-farrells-beloved-styrofoam-cups","620191","Goodbye to Farrell's Beloved Styrofoam Cups","<p>The 32 ounce containers will be phased out after the styrofoam ban begins on July 1.</p>","0.00","0.38","0.05","0.00","0.05","0.00","0.05","1","1"
"1524","/new-york/story/astoria-long-island-city/astoria/quiz-how-well-do-you-know-astoria/","20150602","4010","quiz-how-well-do-you-know-astoria","617108","Quiz: How Well Do You Know Astoria?","<p>Test your knowledge of the neighborhood with our quiz.</p>","0.00","0.07","0.53","0.26","0.26","0.26","0.00","1","2"
"1525","/new-york/features/this-is-new-york/williamsburg-pizzeria-sells-hundreds-of-pizza-on-pizza-slices/","20150602","3941","williamsburg-pizzeria-sells-hundreds-of-pizza-on-pizza-slices","619742","Williamsburg Pizzeria Sells Hundreds of 'Pizza on Pizza' Slices ","<p>Vinnie&#39;s Pizzeria sold more than a dozen whole pies and 300 to 400 slices.</p>","0.00","0.10","0.00","0.00","0.00","0.00","0.00","1","1"
"1526","/new-york/features/this-is-new-york/after-inwood-parks-trashed-locals-organize-on-facebook/","20150602","3900","after-inwood-parks-trashed-locals-organize-on-facebook","619805","After Inwood Parks Trashed, Locals Organize on Facebook","<p>Residents said large weekend&nbsp;parties regularly cover&nbsp;the park in garabge while trash cans appear empty.</p>","0.00","0.00","0.05","0.00","0.00","0.11","0.00","-1","7"
"1528","/new-york/story/rockaways/far-rockaway/woman-dies-after-getting-butt-injections-far-rockaway-home-sources-say/","20150602","2844","woman-dies-after-getting-butt-injections-far-rockaway-home-sources-say","620174","Woman Dies After Getting Butt Injections in Far Rockaway Home, Sources Say","<p>The 34-year-old victim came with her mother to a Far Rockaway home for the procedure, sources said.</p>","0.00","0.00","0.00","0.00","0.11","0.11","0.00","-1","7"
"1529","/new-york/features/shop-city/where-shop-for-swimwear-city/","20150602","2728","where-shop-for-swimwear-city","617670","Where to Shop for Swimwear In the City","<p>Ordering online is overrated. Shop for swimwear with a dressing room nearby.</p>","0.00","0.23","0.00","0.00","0.00","0.13","0.00","-1","1"
"1531","/new-york/features/on-inside/interactive-map-rise-serious-crime-seen-most-nypd-precincts/","20150603","10897","interactive-map-rise-serious-crime-seen-most-nypd-precincts","620317","INTERACTIVE MAP: Rise in Serious Crime Seen in Most NYPD Precincts","<p>And it&#39;s not just murders and shootings that are increasing across most of New York City.</p><p>&nbsp;</p>","0.00","0.13","0.23","0.13","0.30","0.11","0.00","-1","4"
"1532","/new-york/features/openings-closings/pommes-frites-moving-greenwich-village-for-cheaper-rent/","20150603","8201","pommes-frites-moving-greenwich-village-for-cheaper-rent","620280","Pommes Frites Moving to Greenwich Village for Cheaper Rent","<p>Its owners said they could not find an affordable location in the East Village.</p>","0.00","0.18","0.07","0.06","0.07","0.00","0.07","-1","1"
"1533","/new-york/features/this-is-new-york/goodbye-farrells-beloved-styrofoam-cups/","20150603","6596","goodbye-farrells-beloved-styrofoam-cups","620191","Goodbye to Farrell's Beloved Styrofoam Cups","<p>The 32 ounce containers will be phased out after the styrofoam ban begins on July 1.</p>","0.00","0.38","0.05","0.00","0.05","0.00","0.05","1","1"
"1534","/new-york/features/apartmentality/map-see-most-popular-neighborhoods-for-working-from-home/","20150603","4265","map-see-most-popular-neighborhoods-for-working-from-home","620263","MAP: See the Most Popular Neighborhoods for Working From Home","<p>More New Yorkers are opting to work from home and in co-working spaces.</p>","0.00","0.03","0.00","0.03","0.00","0.12","0.00","-1","7"
"1536","/new-york/story/riverdale-kingsbridge/riverdale/heres-why-obamas-should-move-bronx/","20150603","3146","heres-why-obamas-should-move-bronx","619812","Here's Why the Obamas Should Move to The Bronx","<p>Real estate brokers said the neighborhood would make a great fit for Barack Obama&#39;s post-presidency.</p>","0.00","0.15","0.06","0.06","0.10","0.03","0.10","-1","1"
"1538","/new-york/promotions/summer-city-2015/story/your-guide-events-on-governors-island-this-summer/","20150603","2770","your-guide-events-on-governors-island-this-summer","619477","Your Guide to Events on Governors Island This Summer","<p>A short boat ride transports you to an oasis of relaxation on Governors Island.</p>","0.00","0.11","0.00","0.00","0.00","0.00","0.03","-1","1"
"1539","/new-york/story/rockaways/far-rockaway/woman-dies-after-getting-butt-injections-far-rockaway-home-sources-say/","20150603","2710","woman-dies-after-getting-butt-injections-far-rockaway-home-sources-say","620174","Woman Dies After Getting Butt Injections in Far Rockaway Home, Sources Say","<p>The 34-year-old victim came with her mother to a Far Rockaway home for the procedure, sources said.</p>","0.00","0.00","0.00","0.00","0.11","0.11","0.00","-1","7"
"1540","/new-york/story/forest-hills-rego-park-jamaica/forest-hills/forest-hills-street-festival-feature-beer-wine-hookah-gardens/","20150603","2299","forest-hills-street-festival-feature-beer-wine-hookah-gardens","620196","Forest Hills Street Festival to Feature Beer, Wine and Hookah Gardens ","<p>The annual Festival of the Arts will take place on June 14 on Austin Street.</p>","0.00","0.00","0.00","0.00","0.03","0.00","0.00","-1","7"
"1541","/new-york/story/washington-heights-inwood/hudson-heights/4-year-old-girl-told-she-cant-be-spider-man-so-locals-throw-her-parade/","20150604","5397","4-year-old-girl-told-she-cant-be-spider-man-so-locals-throw-her-parade","620801","4-Year-Old Girl Told She Can't Be Spider-Man, So Locals Throw Her a Parade","<p>The Uptown Superheroes March was organized after boys told her she couldn&#39;t be her favorite hero.</p>","0.00","0.05","0.05","0.00","0.05","0.00","0.05","-1","7"
"1543","/new-york/features/on-inside/video-new-yorkers-restrain-man-who-mugged-arizona-tourist/","20150604","3072","video-new-yorkers-restrain-man-who-mugged-arizona-tourist","621159","VIDEO: New Yorkers Restrain Man Who Mugged Arizona Mom","<p>Video shows Good Samaritans capturing suspect and recovering victim&#39;s cash.</p>","0.00","0.75","0.10","0.10","0.00","0.10","0.00","1","1"
