"row_id","path","date","views","pathTail","story_id","headline","teaser","neutral","happy","sad","fear","anger","disgust","surprise","valence","primary_emotion"
"903","/new-york/features/apartmentality/how-mortgage-rate-hikes-could-help-or-hurt-your-chances-of-buying","20150401","6738","how-mortgage-rate-hikes-could-help-or-hurt-your-chances-of-buying","602909","How Mortgage Rate Hikes Could Help or Hurt Your Chances of Buying ","<p>Rate hikes affect purchasing power but also might change the dynamics of the NYC market.</p>","0.00","0.09","0.75","0.09","0.10","0.03","0.10","-1","2"
"904","/new-york/story/south-bronx/hunts-point/couple-offers-60-cuddle-session-for-touch-deprived-strangers","20150401","4446","couple-offers-60-cuddle-session-for-touch-deprived-strangers","602906","Couple Offers $60 Cuddle Session for 'Touch-Deprived' Strangers","<p>Noelia Bonilla and Charlie Amadiz offer a cuddle with no &quot;pressure to take it to the next level.&quot;</p>","0.00","0.08","0.00","0.00","0.08","0.00","0.00","-1","7"
"905","/new-york/story/murray-hill-gramercy-midtown-east/murray-hill/64-affordable-apartments-for-as-low-as-565-coming-madison-avenue","20150401","3281","64-affordable-apartments-for-as-low-as-565-coming-madison-avenue","603530","64 Affordable Apartments for as Low as $565 Coming to Madison Avenue","<p>Lottery for 160 Madison Ave., which will offer 64 affordable units, has now opened.</p>","0.00","0.00","0.18","0.00","0.00","0.04","0.00","-1","7"
"908","/new-york/story/downtown/civic-center/detective-who-screamed-at-uber-driver-is-removed-from-elite-post-bratton","20150401","2320","detective-who-screamed-at-uber-driver-is-removed-from-elite-post-bratton","603501","Detective Who Screamed at Uber Driver Removed From Elite Post: Bratton ","<p>Det. Patrick Cherry has been placed on modified duty and transferred out of his elite command.</p>","0.00","0.00","0.04","0.00","0.00","0.00","0.00","-1","7"
"909","/new-york/story/east-village-lower-east-side/east-village/east-village-building-that-caused-blast-had-prior-fire-due-faulty-wires","20150401","2038","east-village-building-that-caused-blast-had-prior-fire-due-faulty-wires","602925","East Village Building That Caused Blast Had Prior Fire Due to Faulty Wires","<p>A commercial tenant sued the landlord in 2000 after his variety store was destroyed in a fire.</p>","0.00","0.00","0.15","0.04","0.11","0.00","0.04","-1","7"
"911","/new-york/features/local-moguls/future-of-shopping-includes-instagram-sensory-experiences","20150402","7924","future-of-shopping-includes-instagram-sensory-experiences","603459","Sensory Experiences Shape the Future of NYC Retail","<p class=""rtejustify"">From swanky Brookfield Place to indie Brooklyn chocolatiers, it&#39;s all about creating experiences.</p>","0.00","0.20","0.20","0.00","0.00","0.00","0.00","-1","7"
"912","/new-york/story/murray-hill-gramercy-midtown-east/murray-hill/64-affordable-apartments-for-as-low-as-565-coming-madison-avenue","20150402","6407","64-affordable-apartments-for-as-low-as-565-coming-madison-avenue","603530","64 Affordable Apartments for as Low as $565 Coming to Madison Avenue","<p>Lottery for 160 Madison Ave., which will offer 64 affordable units, has now opened.</p>","0.00","0.00","0.18","0.00","0.00","0.04","0.00","-1","7"
"914","/new-york/story/murray-hill-gramercy-midtown-east/union-square/police-arrest-3-women-for-selling-churros-union-square-subway-station","20150402","3238","police-arrest-3-women-for-selling-churros-union-square-subway-station","602895","Police Arrest 3 Women For Selling Churros in Union Square Subway Station","<p>The women were arrested on the L train platform for selling without a license, police said.</p>","0.17","0.00","0.00","0.00","0.00","0.00","0.00","0","0"
"917","/new-york/story/williamsburg-greenpoint-bushwick/greenpoint/brooklyn-art-dealer-accused-of-selling-stolen-ancient-artifacts-for-500k","20150402","2306","brooklyn-art-dealer-accused-of-selling-stolen-ancient-artifacts-for-500k","603110","Brooklyn Art Dealer Accused of Selling Stolen Ancient Artifacts for $500K","<p>Manhattan prosecutors say in court papers Nayef Homsi is expected to be arrested in the near future.</p>","0.00","0.15","0.05","0.00","0.05","0.00","0.05","1","1"
"918","/new-york/story/south-bronx/claremont/dramatic-car-crash-video-shows-pedestrian-hurtling-through-air","20150402","2247","dramatic-car-crash-video-shows-pedestrian-hurtling-through-air","603524","Dramatic Car Crash Video Shows Pedestrian Hurtling Through Air","<p>The collision took place on March 20 at Grand Concourse and East 170th Street.</p>","0.00","0.24","0.00","0.04","0.04","0.24","0.24","-1","7"
"919","/new-york/story/downtown/civic-center/two-queens-women-arrested-for-terrorism-plot-officials-say","20150402","1909","two-queens-women-arrested-for-terrorism-plot-officials-say","603730","Two Queens Women Considered Bombing NYPD Funeral, Prosecutors Say","<p>Noelle Velentzas and Asia Siddiqui were arrested Thursday for an al-Qaida-inspired plot, officials said.</p>","0.17","0.00","0.00","0.00","0.00","0.00","0.00","0","0"
"920","/new-york/features/on-inside/heres-what-investigators-are-looking-for-under-east-village-blast-rubble","20150402","1714","heres-what-investigators-are-looking-for-under-east-village-blast-rubble","603076","Here's What Investigators Are Looking For Under East Village Blast Rubble","<p>Investigators sifting for gas stove hose used to &quot;improperly&quot; siphon gas from restaurant to apartments.</p>","0.17","0.00","0.00","0.00","0.00","0.00","0.00","0","0"
"921","/new-york/story/upper-east-side-roosevelt-island/upper-east-side/hamburglar-artist-throws-gnawed-cheeseburgers-at-people-from-bike","20150403","116243","hamburglar-artist-throws-gnawed-cheeseburgers-at-people-from-bike","203998","'Hamburglar' Artist Throws Gnawed Cheeseburgers at People From Bike","<p>Nate Hill&#39;s performance art on the UES involves tossing partially-eaten cheeseburgers from a bike.</p>
","0.00","0.00","0.11","0.11","0.00","0.11","0.00","-1","7"
"922","/new-york/story/upper-east-side-roosevelt-island/upper-east-side/de-blasio-dips-toe-into-presidential-politics-with-meeting-of-liberals","20150403","18393","de-blasio-dips-toe-into-presidential-politics-with-meeting-of-liberals","603922","De Blasio Dips Toe Into Presidential Politics With Meeting of Liberals","<p>The mayor said he has no current national ambitions and plans to run for re-election.</p>","0.00","0.01","0.00","0.00","0.00","0.00","0.00","-1","1"
"924","/new-york/story/east-village-lower-east-side/lower-east-side/celebrate-passover-at-these-7-restaurants-city","20150403","4178","celebrate-passover-at-these-7-restaurants-city","603560","Celebrate Passover at These 7 Restaurants in the City","<p>Try a Portuguese, Chinese or Mexican-influenced Passover meal.</p>","0.00","0.23","0.00","0.00","0.00","0.00","0.00","1","1"
"926","/new-york/story/murray-hill-gramercy-midtown-east/murray-hill/64-affordable-apartments-for-as-low-as-565-coming-madison-avenue","20150403","3067","64-affordable-apartments-for-as-low-as-565-coming-madison-avenue","603530","64 Affordable Apartments for as Low as $565 Coming to Madison Avenue","<p>Lottery for 160 Madison Ave., which will offer 64 affordable units, has now opened.</p>","0.00","0.00","0.18","0.00","0.00","0.04","0.00","-1","7"
"927","/new-york/features/local-moguls/future-of-shopping-includes-instagram-sensory-experiences","20150403","2591","future-of-shopping-includes-instagram-sensory-experiences","603459","Sensory Experiences Shape the Future of NYC Retail","<p class=""rtejustify"">From swanky Brookfield Place to indie Brooklyn chocolatiers, it&#39;s all about creating experiences.</p>","0.00","0.20","0.20","0.00","0.00","0.00","0.00","-1","7"
"928","/new-york/features/open-house-insider/open-house-agenda-3-apartments-see-this-weekend","20150403","2538","open-house-agenda-3-apartments-see-this-weekend","641635","Open House Agenda: 3 Apartments to See This Weekend","<p>These units offer good looks, good value and a little something extra.</p>","0.00","0.75","0.06","0.60","0.53","0.53","0.09","-1","1"
"930","/new-york/story/astoria-long-island-city/astoria/new-astoria-greek-eatery-offer-gyros-shot-glass","20150403","1697","new-astoria-greek-eatery-offer-gyros-shot-glass","603892","New Astoria Greek Eatery to Offer Gyros in a Shot Glass","<p>SVL Bar will open its doors at 31st Street and Astoria Boulevard in the next month or two.</p>","0.00","0.00","0.00","0.00","0.00","0.05","0.00","-1","7"
"931","/new-york/story/upper-east-side-roosevelt-island/upper-east-side/hamburglar-artist-throws-gnawed-cheeseburgers-at-people-from-bike","20150404","23358","hamburglar-artist-throws-gnawed-cheeseburgers-at-people-from-bike","203998","'Hamburglar' Artist Throws Gnawed Cheeseburgers at People From Bike","<p>Nate Hill&#39;s performance art on the UES involves tossing partially-eaten cheeseburgers from a bike.</p>
","0.00","0.00","0.11","0.11","0.00","0.11","0.00","-1","7"
"932","/new-york/story/upper-east-side-roosevelt-island/upper-east-side/de-blasio-dips-toe-into-presidential-politics-with-meeting-of-liberals","20150404","2850","de-blasio-dips-toe-into-presidential-politics-with-meeting-of-liberals","603922","De Blasio Dips Toe Into Presidential Politics With Meeting of Liberals","<p>The mayor said he has no current national ambitions and plans to run for re-election.</p>","0.00","0.01","0.00","0.00","0.00","0.00","0.00","-1","1"
"933","/new-york/story/downtown/civic-center/nypd-detective-who-ranted-at-uber-driver-goes-before-ccrb-apologizes","20150404","2183","nypd-detective-who-ranted-at-uber-driver-goes-before-ccrb-apologizes","604283","NYPD Detective Who Ranted at Uber Driver Goes Before CCRB, And Apologizes","<p>Det. Patrick Cherry admitted he was out of line and apologized for yelling at the driver.</p><p>&nbsp;</p>","0.00","0.00","0.38","0.00","0.00","0.00","0.00","-1","7"
"935","/new-york/story/murray-hill-gramercy-midtown-east/murray-hill/64-affordable-apartments-for-as-low-as-565-coming-madison-avenue","20150404","1202","64-affordable-apartments-for-as-low-as-565-coming-madison-avenue","603530","64 Affordable Apartments for as Low as $565 Coming to Madison Avenue","<p>Lottery for 160 Madison Ave., which will offer 64 affordable units, has now opened.</p>","0.00","0.00","0.18","0.00","0.00","0.04","0.00","-1","7"
"936","/new-york/story/east-village-lower-east-side/east-village/sting-donates-36k-east-village-explosion-fundraiser-organizer-says","20150404","1132","sting-donates-36k-east-village-explosion-fundraiser-organizer-says","604190","Sting Donates $36K to East Village Explosion Fundraiser, Organizer Says","<p>Proceeds from the benefit will be donated to local non-profit organization Good Old Lower East Side.</p>","0.00","0.15","0.75","0.38","0.38","0.38","0.05","1","2"
"938","/new-york/features/open-house-insider/open-house-agenda-3-apartments-see-this-weekend","20150404","973","open-house-agenda-3-apartments-see-this-weekend","641635","Open House Agenda: 3 Apartments to See This Weekend","<p>These units offer good looks, good value and a little something extra.</p>","0.00","0.75","0.06","0.60","0.53","0.53","0.09","-1","1"
"939","/new-york/story/east-village-lower-east-side/lower-east-side/celebrate-passover-at-these-7-restaurants-city","20150404","822","celebrate-passover-at-these-7-restaurants-city","603560","Celebrate Passover at These 7 Restaurants in the City","<p>Try a Portuguese, Chinese or Mexican-influenced Passover meal.</p>","0.00","0.23","0.00","0.00","0.00","0.00","0.00","1","1"
"940","/new-york/features/get-out-do-this/6-things-for-you-do-new-york-citys-neighborhoods-this-weekend","20150404","810","6-things-for-you-do-new-york-citys-neighborhoods-this-weekend","625291","6 Things for You to Do in New York City's Neighborhoods This Weekend","<p>Summer&#39;s here! Catch the Mermaid Parade, Make Music New York and Pride Week.</p>","0.00","0.23","0.04","0.04","0.04","0.05","0.01","-1","1"
"941","/new-york/story/upper-east-side-roosevelt-island/upper-east-side/hamburglar-artist-throws-gnawed-cheeseburgers-at-people-from-bike","20150405","1058","hamburglar-artist-throws-gnawed-cheeseburgers-at-people-from-bike","203998","'Hamburglar' Artist Throws Gnawed Cheeseburgers at People From Bike","<p>Nate Hill&#39;s performance art on the UES involves tossing partially-eaten cheeseburgers from a bike.</p>
","0.00","0.00","0.11","0.11","0.00","0.11","0.00","-1","7"
"942","/new-york/story/downtown/civic-center/nypd-detective-who-ranted-at-uber-driver-goes-before-ccrb-apologizes","20150405","981","nypd-detective-who-ranted-at-uber-driver-goes-before-ccrb-apologizes","604283","NYPD Detective Who Ranted at Uber Driver Goes Before CCRB, And Apologizes","<p>Det. Patrick Cherry admitted he was out of line and apologized for yelling at the driver.</p><p>&nbsp;</p>","0.00","0.00","0.38","0.00","0.00","0.00","0.00","-1","7"
"943","/new-york/story/upper-west-side-morningside-heights/upper-west-side/womans-20k-engagement-ring-stolen-from-upper-west-side-gym-police-say","20150405","638","womans-20k-engagement-ring-stolen-from-upper-west-side-gym-police-say","604129","Woman's $20K Engagement Ring Stolen from Upper West Side Gym, Police Say","<p>The woman left the ring unattended at the Columbus Avenue gym, police said.&nbsp;</p>","0.00","0.00","0.20","0.00","0.00","0.00","0.00","-1","7"
"944","/new-york/story/chelsea-hells-kitchen/hells-kitchen-clinton/dykes-lumber-shuts-down-century-old-hells-kitchen-yard","20150405","603","dykes-lumber-shuts-down-century-old-hells-kitchen-yard","602885","Dykes Lumber Shuts Down Century-Old Hell's Kitchen Yard","<p>The building sold to a real estate developer, records show.&nbsp;</p>","0.00","0.04","0.11","0.00","0.03","0.00","0.00","-1","2"
"945","/new-york/story/east-village-lower-east-side/east-village/sting-donates-36k-east-village-explosion-fundraiser-organizer-says","20150405","601","sting-donates-36k-east-village-explosion-fundraiser-organizer-says","604190","Sting Donates $36K to East Village Explosion Fundraiser, Organizer Says","<p>Proceeds from the benefit will be donated to local non-profit organization Good Old Lower East Side.</p>","0.00","0.15","0.75","0.38","0.38","0.38","0.05","1","2"
"946","/new-york/features/local-moguls/future-of-shopping-includes-instagram-sensory-experiences","20150405","558","future-of-shopping-includes-instagram-sensory-experiences","603459","Sensory Experiences Shape the Future of NYC Retail","<p class=""rtejustify"">From swanky Brookfield Place to indie Brooklyn chocolatiers, it&#39;s all about creating experiences.</p>","0.00","0.20","0.20","0.00","0.00","0.00","0.00","-1","7"
"947","/new-york/story/greenwich-village-soho/greenwich-village/tipster-leads-officers-man-accused-of-threatening-pregnant-woman","20150405","520","tipster-leads-officers-man-accused-of-threatening-pregnant-woman","604241","Tipster Leads Officers to Man Accused of Threatening Pregnant Woman","<p>Police arrested Melvin Johnson days after a pregnant woman was threatened at a Greenwich Village ATM.</p>","0.00","0.00","0.00","0.12","0.00","0.15","0.00","-1","7"
"948","/new-york/features/openings-closings/mexican-bar-backyard-taco-truck-opens-bed-stuy","20150405","511","mexican-bar-backyard-taco-truck-opens-bed-stuy","604115","Mexican Bar and Backyard Taco Truck Opens in Bed-Stuy ","<p>The new Franklin Avenue spot Chilo&#39;s&nbsp;features $2.50 tacos and frozen margaritas.&nbsp;</p>","0.00","0.00","0.00","0.00","0.00","0.05","0.00","-1","7"
"949","/new-york/story/harlem/central-harlem/man-arrested-for-assaulting-three-women-one-night","20150405","461","man-arrested-for-assaulting-three-women-one-night","604303","Man Arrested for Assaulting Three Women in One Night","<p>Edward Major, 55, sent one of his victims to the hospital with a broken nose, police said.</p>","0.00","0.15","0.15","0.09","0.03","0.03","0.00","-1","7"
"950","/new-york/features/get-out-do-this/4-things-for-you-do-new-york-citys-neighborhoods-this-week","20150405","442","4-things-for-you-do-new-york-citys-neighborhoods-this-week","613405","4 Things for You to Do in New York City's Neighborhoods This Week","<p>S&aacute;mi culture, jazz stories and the Frieze Art Fair are on this week&#39;s agenda.</p>","0.00","0.23","0.04","0.04","0.15","0.05","0.00","1","1"
"951","/new-york/story/murray-hill-gramercy-midtown-east/midtown-east/churros-vendors-brave-arrest-make-living-subway-system","20150406","6987","churros-vendors-brave-arrest-make-living-subway-system","604223","Churros Vendors Brave Arrest to Make a Living in the Subway System","<p>Churros vendor Ana Alvarado says&nbsp;police confiscated and ate&nbsp;her churros&nbsp;after arresting her.</p>","0.00","0.12","0.03","0.01","0.01","0.12","0.12","-1","7"
"952","/new-york/story/downtown/civic-center/hallucinogenic-mushrooms-steak-dinners-among-unusual-stuff-nypd-buys","20150406","5608","hallucinogenic-mushrooms-steak-dinners-among-unusual-stuff-nypd-buys","603847","Hallucinogenic Mushrooms and Steak Dinners Among Unusual Stuff NYPD Buys","<p>The NYPD bought hallucinogenic mushrooms and meals at Peter Luger Steak House in the past five years.</p>","0.00","0.04","0.23","0.11","0.11","0.11","0.00","1","2"
"955","/new-york/story/washington-heights-inwood/washington-heights/uptown-restaurant-week-whin-dine-returns-for-third-year","20150406","2073","uptown-restaurant-week-whin-dine-returns-for-third-year","604184","Uptown Restaurant Week #WHIN and Dine Returns for Third Year ","<p>The event features prix-fixe dinners at 28 restaurants around the neighborhood.</p>","0.00","0.00","0.18","0.00","0.18","0.00","0.18","-1","7"
"956","/new-york/story/astoria-long-island-city/astoria/man-shot-death-at-astoria-houses-police-say","20150406","2057","man-shot-death-at-astoria-houses-police-say","604437","Father of 2 Shot to Death at Astoria Houses, Police Say","<p>Sean Overton was fatally shot in the neck and torso, police said.</p>","0.00","0.00","0.75","0.00","0.00","0.00","0.00","-1","7"
"957","/new-york/story/astoria-long-island-city/sunnyside/sunnyside-resident-starts-facebook-group-chronicle-7-train-problems","20150406","2052","sunnyside-resident-starts-facebook-group-chronicle-7-train-problems","604226","Sunnyside Resident Starts Facebook Group to Chronicle 7 Train Problems","<p>Commuters are using &quot;7 Train Blues&quot; to post about delays, suspensions and signal problems on the line.</p>","0.00","0.12","0.10","0.10","0.00","0.12","0.12","-1","7"
"958","/new-york/features/local-moguls/future-of-shopping-includes-instagram-sensory-experiences","20150406","1838","future-of-shopping-includes-instagram-sensory-experiences","603459","Sensory Experiences Shape the Future of NYC Retail","<p class=""rtejustify"">From swanky Brookfield Place to indie Brooklyn chocolatiers, it&#39;s all about creating experiences.</p>","0.00","0.20","0.20","0.00","0.00","0.00","0.00","-1","7"
"959","/new-york/story/rockaways/rockaway-beach/playland-taverns-new-chef-vows-turn-around-rowdy-nightspot","20150406","1679","playland-taverns-new-chef-vows-turn-around-rowdy-nightspot","604186","Playland Tavern's New Chef Vows to Turn Around Rowdy Nightspot","<p>Dan Cipriani, who opened a barbecue food truck in Rockaway Beach last summer, is moving to Playland.&nbsp;</p>","0.00","0.53","0.07","0.06","0.07","0.05","0.07","1","1"
"960","/new-york/features/get-out-do-this/4-things-for-you-do-new-york-citys-neighborhoods-this-week","20150406","1632","4-things-for-you-do-new-york-citys-neighborhoods-this-week","613405","4 Things for You to Do in New York City's Neighborhoods This Week","<p>S&aacute;mi culture, jazz stories and the Frieze Art Fair are on this week&#39;s agenda.</p>","0.00","0.23","0.04","0.04","0.15","0.05","0.00","1","1"
"962","/new-york/story/downtown/tribeca/1500-pre-schoolers-compete-for-325-elite-gt-seats","20150407","7687","1500-pre-schoolers-compete-for-325-elite-gt-seats","604616","1,500 Pre-Schoolers To Compete for 325 Elite G&T Seats","<p>Only 10 percent of 4-year-old test takers qualified for the top G&amp;T programs; 23 percent will get in.</p>","0.00","0.03","0.60","0.60","0.00","0.02","0.02","-1","7"
"963","/new-york/story/murray-hill-gramercy-midtown-east/midtown-east/churros-vendors-brave-arrest-make-living-subway-system","20150407","4357","churros-vendors-brave-arrest-make-living-subway-system","604223","Churros Vendors Brave Arrest to Make a Living in the Subway System","<p>Churros vendor Ana Alvarado says&nbsp;police confiscated and ate&nbsp;her churros&nbsp;after arresting her.</p>","0.00","0.12","0.03","0.01","0.01","0.12","0.12","-1","7"
"964","/new-york/story/south-bronx/concourse-village/bicyclist-fatally-struck-by-van-police-say","20150407","3513","bicyclist-fatally-struck-by-van-police-say","604441","Bicyclist Fatally Struck by Van, Police Say","<p>A bicyclist was killed when a van hit him in Concourse Village Sunday, police said.</p><p>&nbsp;</p>","0.00","0.50","0.00","0.00","0.03","0.00","0.03","1","1"
"965","/new-york/story/greenwich-village-soho/meatpacking-district/man-dies-collapse-at-pastis-construction-site-police-say","20150407","2551","man-dies-collapse-at-pastis-construction-site-police-say","604598","Man Dies In Collapse At Pastis Construction Site, Police Say","<p>A 22-year-old construction worker died after a structural collapse at 19 Ninth Ave., police said.</p>","0.00","0.00","0.00","0.00","0.00","0.00","0.06","0","7"
"966","/new-york/story/washington-heights-inwood/inwood/pet-rabbits-living-inwood-car-lot-must-find-new-home-owner-says","20150407","2419","pet-rabbits-living-inwood-car-lot-must-find-new-home-owner-says","604026","Pet Rabbits Living in Inwood Car Lot Must Find New Home, Owner Says","<p>Charlie Nu&ntilde;ez said police told him the bunnies can no longer live at the lot he manages.</p>","0.00","0.06","0.06","0.00","0.00","0.05","0.00","-1","7"
"967","/new-york/story/murray-hill-gramercy-midtown-east/flatiron/iconic-rizzoli-bookstore-set-reopen-june-building-management-says","20150407","2237","iconic-rizzoli-bookstore-set-reopen-june-building-management-says","604688","Iconic Rizzoli Bookstore Set to Reopen in June, Building Management Says","<p>The bookstore is reopening in its&nbsp;new Flatiron&nbsp;space&nbsp;at 1133 Broadway in June, building management said.</p>","0.00","0.00","0.00","0.00","0.00","0.05","0.00","-1","7"
"968","/new-york/story/downtown/battery-park-city/tribeca-film-festivals-free-drive-in-movies-return-brookfield-place","20150407","2167","tribeca-film-festivals-free-drive-in-movies-return-brookfield-place","604500","Tribeca Film Festival's Free 'Drive-In' Movies Return to Brookfield Place","<p>Watch family-friendly movies under the stars next week in Battery Park City.</p>","0.00","0.23","0.00","0.00","0.00","0.00","0.00","1","1"
"969","/new-york/story/jackson-heights-elmhurst/jackson-heights/accused-terrorist-who-plotted-bombing-campaign-fired-from-job-tutoring-kids","20150407","1650","accused-terrorist-who-plotted-bombing-campaign-fired-from-job-tutoring-kids","604583","Accused Terrorist Who Plotted Bombing Campaign Fired From Job Tutoring Kids","<p>Asia Siddiqui, 31, began working at 82nd Street Academics in January, the school said.</p>","0.00","0.03","0.00","0.10","0.30","0.00","0.00","-1","4"
"971","/new-york/story/south-bronx/morrisania/sal-capone-mal-pacino-among-10-south-bronx-gangsters-busted-nypd","20150408","22135","sal-capone-mal-pacino-among-10-south-bronx-gangsters-busted-nypd","605140","'Sal Capone' and 'Mal Pacino' Among 10 South Bronx Gangsters Busted: NYPD","<p>Police arrested 10 more&nbsp;members of the Lyman Place Bosses, according to officers from the 42nd Precinct.</p>","0.00","0.15","0.00","0.00","0.00","0.00","0.00","-1","1"
"973","/new-york/story/upper-east-side-roosevelt-island/upper-east-side/3-injured-1-critically-upper-east-side-blaze-fdny-says","20150408","2955","3-injured-1-critically-upper-east-side-blaze-fdny-says","605118","3 Injured, 1 Critically, in Upper East Side Blaze, FDNY Says","<p>More than 100 firefighters battled a blaze on East 78th Street, the FDNY said.</p>","0.00","0.00","0.45","0.00","0.00","0.00","0.14","-1","7"
"974","/new-york/story/downtown/financial-district/woman-cuts-ex-with-scissors-for-checking-out-another-lady-on-subway-nypd","20150408","2788","woman-cuts-ex-with-scissors-for-checking-out-another-lady-on-subway-nypd","604839","Woman Cuts Ex With Scissors For Checking Out Another Lady on Subway: NYPD","<p>A 24-year-old sliced her ex-boyfriend&#39;s hand after becoming &quot;irate,&quot; police said.</p>","0.00","0.04","0.00","0.00","0.68","0.00","0.00","-1","4"
"975","/new-york/story/downtown/tribeca/1500-pre-schoolers-compete-for-325-elite-gt-seats","20150408","2203","1500-pre-schoolers-compete-for-325-elite-gt-seats","604616","1,500 Pre-Schoolers To Compete for 325 Elite G&T Seats","<p>Only 10 percent of 4-year-old test takers qualified for the top G&amp;T programs; 23 percent will get in.</p>","0.00","0.03","0.60","0.60","0.00","0.02","0.02","-1","7"
"976","/new-york/features/local-moguls/future-of-shopping-includes-instagram-sensory-experiences","20150408","2179","future-of-shopping-includes-instagram-sensory-experiences","603459","Sensory Experiences Shape the Future of NYC Retail","<p class=""rtejustify"">From swanky Brookfield Place to indie Brooklyn chocolatiers, it&#39;s all about creating experiences.</p>","0.00","0.20","0.20","0.00","0.00","0.00","0.00","-1","7"
"977","/new-york/story/greenwich-village-soho/west-village/water-main-break-floods-west-village-14th-street-station","20150408","2072","water-main-break-floods-west-village-14th-street-station","605416","Water Main Break Floods West Village, 14th Street Station","<p>The water main break caused delays to the 1, 2 and 3 trains on Wednesday, the MTA said.</p>","0.00","0.00","0.01","0.12","0.12","0.00","0.00","-1","7"
