"row_id","path","date","views","pathTail","story_id","headline","teaser","neutral","happy","sad","fear","anger","disgust","surprise","valence","primary_emotion"
"2026","/new-york/story/greenwich-village-soho/soho/know-your-rights-forum-at-church-for-co-op-condo-live-work-tenants/","20150722","3311","know-your-rights-forum-at-church-for-co-op-condo-live-work-tenants","635008","'Know Your Rights' Forum At Church For Co-op, Condo, Live-Work Tenants","<p>The forum will be held Wednesday night at St. Anthony&#39;s Church on Sullivan Street.</p>","0.00","0.07","0.09","0.09","0.05","0.03","0.05","-1","7"
"2027","/new-york/features/this-is-new-york/mta-releases-new-video-showing-its-stone-age-technology/","20150722","3116","mta-releases-new-video-showing-its-stone-age-technology","634889","MTA Releases New Video Showing Its Stone Age Technology","<p>Much of the MTA&#39;s technology predates WWII, a new video shows.</p>","0.00","0.05","0.00","0.00","0.00","0.00","0.00","-1","1"
"2029","/new-york/features/summer-city/best-summer-bike-rides-queens/","20150722","2417","best-summer-bike-rides-queens","633993","Best Summer Bike Rides in Queens ","<p>There are several&nbsp;scenic routes in Queens that bicyclists can try this summer.</p>","0.00","0.34","0.00","0.00","0.00","0.00","0.00","1","1"
"2030","/new-york/story/greenwich-village-soho/west-village/village-chocolate-factory-owners-want-convert-space-luxury-condos/","20150722","2171","village-chocolate-factory-owners-want-convert-space-luxury-condos","635098","Village Chocolate Factory Owners Want to Convert Space to Luxury Condos","<p>The Koppers Chocolate factory owner is petitioning the city to allow them to make the building taller.</p>","0.00","0.23","0.15","0.06","0.01","0.03","0.01","-1","1"
"2031","/new-york/story/greenwich-village-soho/meatpacking-district/meatpacking-biker-bar-hogs-heifers-closing-due-rent-hike-owner-says/","20150723","8209","meatpacking-biker-bar-hogs-heifers-closing-due-rent-hike-owner-says","635092","Meatpacking Biker Bar Hogs and Heifers Closing Due To Rent Hike, Owner Says","<p>Owner Michelle Dell said her landlord wants to charge $60,000 per month for her space.</p>","0.00","0.00","0.07","0.00","0.00","0.00","0.02","-1","7"
"2032","/new-york/features/summer-city/14-of-best-frozen-treats-city/","20150723","4213","14-of-best-frozen-treats-city","635415","14 of the Best Frozen Treats in the City","<p>Cool it down with these icy confections from all over the city.</p>","0.00","0.23","0.20","0.15","0.03","0.00","0.00","1","1"
"2035","/new-york/features/this-is-new-york/do-right-thing-is-first-work-of-art-lend-its-name-city-street/","20150723","2193","do-right-thing-is-first-work-of-art-lend-its-name-city-street","635053","'Do the Right Thing' Is First Work of Art to Lend Its Name to a City Block","<p>&quot;Do the Right Thing&quot; is&nbsp;the first work of art to lend&nbsp;a city street its title as a secondary name.</p>","0.00","0.90","0.04","0.06","0.04","0.04","0.00","1","1"
"2036","/new-york/features/summer-city/18-things-for-you-do-when-everyones-left-city-summer/","20150723","2046","18-things-for-you-do-when-everyones-left-city-summer","634125","18 Things for You To Do When Everyone's Left the City in the Summer","<p>There are great perks to staying put in New York City&nbsp;during summer.</p>","0.00","0.23","0.04","0.04","0.04","0.05","0.00","1","1"
"2037","/new-york/features/this-is-new-york/meet-pickle-dog-taking-over-new-york-city-art-scene/","20150723","1793","meet-pickle-dog-taking-over-new-york-city-art-scene","634920","Meet Pickle, the Dog Taking Over the New York City Art Scene","<p>Most dogs are happy with a bone. Pickle the French bulldog prefers gallery hopping in the city.</p>","0.00","0.75","0.07","0.07","0.00","0.05","0.00","1","1"
"2038","/new-york/story/chelsea-hells-kitchen/chelsea/momofuku-coming-eighth-avenue-west-21st-street/","20150723","1475","momofuku-coming-eighth-avenue-west-21st-street","635530","Momofuku Coming to Eighth Avenue and West 21st Street","<p>David Chang&#39;s Momofuku empire specializes in noodles, pork buns and layer cakes.</p>","0.17","0.00","0.00","0.00","0.00","0.00","0.00","0","0"
"2039","/new-york/story/norwood-bedford-park/bedford-park/13-gang-members-arrested-massive-bronx-takedown-da-says/","20150723","1304","13-gang-members-arrested-massive-bronx-takedown-da-says","635159","13 Gang Members Arrested in Massive Bronx Takedown, DA Says","<p>The Bronx DA&#39;s office announced the indictment of several suspected Bloods affiliates.</p>","0.17","0.00","0.00","0.00","0.00","0.00","0.00","0","0"
"2040","/new-york/story/jackson-heights-elmhurst/jackson-heights/jackson-heights-historic-district-home-sells-for-13m-records-show/","20150723","1251","jackson-heights-historic-district-home-sells-for-13m-records-show","635376","Jackson Heights Historic District Home Sells for $1.3M, Records Show","<p>The semi-detached brick home shattered records for homes in the Jackson Heights historic district.</p>","0.17","0.00","0.00","0.00","0.00","0.00","0.00","0","0"
"2042","/new-york/features/open-house-insider/open-house-agenda-3-unusual-apartments-see-this-weekend/","20150724","5159","open-house-agenda-3-unusual-apartments-see-this-weekend","635619","Open House Agenda: 3 Unusual Apartments to See This Weekend","<p>Move into a former church, a condo with four private outdoor spaces or a house barge.</p>","0.00","0.23","0.06","0.06","0.10","0.00","0.10","-1","1"
"2044","/new-york/features/this-is-new-york/mouse-perches-under-restaurants-a-grade-sign-ultimate-act-of-defiance/","20150724","4317","mouse-perches-under-restaurants-a-grade-sign-ultimate-act-of-defiance","636046","This Mouse Doesn't Care About Restaurant's A Grade","<p>Nobody puts this rodent in the corner.</p>","0.00","0.00","0.00","0.14","0.05","0.00","0.00","-1","7"
"2045","/new-york/features/get-out-do-this/13-things-do-manhattan-neighborhoods-this-weekend/","20150724","3305","13-things-do-manhattan-neighborhoods-this-weekend","635829","13 Things for You To Do in Manhattan Neighborhoods This Weekend","<p>Several events are happening this weekend, including free movie screenings, festivals and a water fight.</p>","0.00","0.00","0.09","0.08","0.09","0.04","0.15","-1","7"
"2047","/new-york/features/this-is-new-york/alligator-spotted-crossing-inwood-street/","20150724","2245","alligator-spotted-crossing-inwood-street","636051","Alligator Spotted Crossing Inwood Street Has Died, Shelter Says","<p>Police picked up the reptile at Ninth Avenue near 205th Street.</p>","0.00","0.15","0.00","0.00","0.00","0.00","0.00","1","1"
"2048","/new-york/features/get-out-do-this/7-things-do-staten-islands-neighborhoods-this-weekend/","20150724","1694","7-things-do-staten-islands-neighborhoods-this-weekend","635875","7 Things To Do in Staten Island's Neighborhoods This Weekend","<p>Visit a pig roast, shop at an artist market or catch some moths.</p>","0.00","0.10","0.04","0.04","0.04","0.13","0.00","-1","5"
"2049","/new-york/features/get-out-do-this/11-things-do-your-brooklyn-neighborhood-this-weekend/","20150724","1550","11-things-do-your-brooklyn-neighborhood-this-weekend","647559","11 Things to Do in Your Brooklyn Neighborhood This Weekend","<p>A Dolly Parton tribute, a puppet burlesque show and &quot;Gilmore Girls&quot; trivia are all on the menu.</p>","0.00","0.20","0.20","0.04","0.04","0.04","0.00","-1","7"
"2050","/new-york/story/greenwich-village-soho/meatpacking-district/meatpacking-biker-bar-hogs-heifers-closing-due-rent-hike-owner-says/","20150724","1216","meatpacking-biker-bar-hogs-heifers-closing-due-rent-hike-owner-says","635092","Meatpacking Biker Bar Hogs and Heifers Closing Due To Rent Hike, Owner Says","<p>Owner Michelle Dell said her landlord wants to charge $60,000 per month for her space.</p>","0.00","0.00","0.07","0.00","0.00","0.00","0.02","-1","7"
"2054","/new-york/features/this-is-new-york/mouse-perches-under-restaurants-a-grade-sign-ultimate-act-of-defiance/","20150725","1929","mouse-perches-under-restaurants-a-grade-sign-ultimate-act-of-defiance","636046","This Mouse Doesn't Care About Restaurant's A Grade","<p>Nobody puts this rodent in the corner.</p>","0.00","0.00","0.00","0.14","0.05","0.00","0.00","-1","7"
"2055","/new-york/features/open-house-insider/open-house-agenda-3-unusual-apartments-see-this-weekend/","20150725","1601","open-house-agenda-3-unusual-apartments-see-this-weekend","635619","Open House Agenda: 3 Unusual Apartments to See This Weekend","<p>Move into a former church, a condo with four private outdoor spaces or a house barge.</p>","0.00","0.23","0.06","0.06","0.10","0.00","0.10","-1","1"
"2057","/new-york/features/this-is-new-york/city-workers-rescue-cat-from-manhattan-bridge/","20150725","995","city-workers-rescue-cat-from-manhattan-bridge","636291","City Workers Rescue Cat From Manhattan Bridge","<p>DOT workers closed a lane of traffic so Animal Care Centers of NYC workers could rescue the cat.</p>","0.00","0.23","0.08","0.14","0.00","0.08","0.00","-1","1"
"2058","/new-york/story/harlem/east-harlem/prisoner-escapes-from-25th-precinct-east-harlem-police-say/","20150725","970","prisoner-escapes-from-25th-precinct-east-harlem-police-say","636303","Prisoner Escapes From 25th Precinct in East Harlem, Police Say","<p>The prisoner escaped around 6:30 p.m. on Friday, police said.</p>","0.17","0.00","0.00","0.00","0.00","0.00","0.00","0","0"
"2059","/new-york/story/bedford-stuyvesant/bed-stuy/photographer-documents-classic-cars-on-city-streets/","20150725","871","photographer-documents-classic-cars-on-city-streets","636062","Photographer Documents Classic Cars on City Streets ","<p>Christopher Benton takes shots of vintage vehicles he sees throughout the city for his blog &quot;Rides.&quot;</p>","0.00","0.23","0.00","0.00","0.00","0.00","0.00","1","1"
"2060","/new-york/features/get-out-do-this/13-things-do-manhattan-neighborhoods-this-weekend/","20150725","765","13-things-do-manhattan-neighborhoods-this-weekend","635829","13 Things for You To Do in Manhattan Neighborhoods This Weekend","<p>Several events are happening this weekend, including free movie screenings, festivals and a water fight.</p>","0.00","0.00","0.09","0.08","0.09","0.04","0.15","-1","7"
"2061","/new-york/story/fort-greene-dumbo/downtown-brooklyn/convicted-felon-attacks-court-officer-seconds-after-guilty-verdict-da-says/","20150726","1968","convicted-felon-attacks-court-officer-seconds-after-guilty-verdict-da-says","635245","Convicted Felon Attacks Court Officer Seconds After Guilty Verdict, DA Says","<p>Dante Newman was indicted for assaulting two court officers just after being convicted of a shooting.</p>","0.00","0.09","0.10","0.04","0.10","0.00","0.04","-1","7"
"2064","/new-york/features/this-is-new-york/city-workers-rescue-cat-from-manhattan-bridge/","20150726","908","city-workers-rescue-cat-from-manhattan-bridge","636291","City Workers Rescue Cat From Manhattan Bridge","<p>DOT workers closed a lane of traffic so Animal Care Centers of NYC workers could rescue the cat.</p>","0.00","0.23","0.08","0.14","0.00","0.08","0.00","-1","1"
"2066","/new-york/story/south-bronx/concourse/bronx-dominican-parade-march-on-sunday/","20150726","848","bronx-dominican-parade-march-on-sunday","634860","Bronx Dominican Parade to March on Sunday","<p>The parade will run along Grand Concourse from East Tremont Avenue to East 166th Street.</p>","0.00","0.50","0.00","0.01","0.00","0.24","0.24","1","1"
"2067","/new-york/features/this-is-new-york/mouse-perches-under-restaurants-a-grade-sign-ultimate-act-of-defiance/","20150726","668","mouse-perches-under-restaurants-a-grade-sign-ultimate-act-of-defiance","636046","This Mouse Doesn't Care About Restaurant's A Grade","<p>Nobody puts this rodent in the corner.</p>","0.00","0.00","0.00","0.14","0.05","0.00","0.00","-1","7"
"2068","/new-york/story/harlem/east-harlem/prisoner-escapes-from-25th-precinct-east-harlem-police-say/","20150726","665","prisoner-escapes-from-25th-precinct-east-harlem-police-say","636303","Prisoner Escapes From 25th Precinct in East Harlem, Police Say","<p>The prisoner escaped around 6:30 p.m. on Friday, police said.</p>","0.17","0.00","0.00","0.00","0.00","0.00","0.00","0","0"
"2069","/new-york/features/open-house-insider/open-house-agenda-3-unusual-apartments-see-this-weekend/","20150726","588","open-house-agenda-3-unusual-apartments-see-this-weekend","635619","Open House Agenda: 3 Unusual Apartments to See This Weekend","<p>Move into a former church, a condo with four private outdoor spaces or a house barge.</p>","0.00","0.23","0.06","0.06","0.10","0.00","0.10","-1","1"
"2070","/new-york/story/south-bronx/mott-haven/youtube-studio-open-bronx-september/","20150726","576","youtube-studio-open-bronx-september","635166","'YouTube' Studio to Open in The Bronx in September","<p>The studio will be located in the heart of The Hub at 370 East 149th St.</p>","0.00","0.05","0.05","0.00","0.05","0.00","0.05","-1","7"
"2071","/new-york/story/ditmas-park-flatbush/flatbush/video-police-punch-suspect-during-arrest-brooklyn-target/","20150727","4910","video-police-punch-suspect-during-arrest-brooklyn-target","636531","VIDEO: Police Punch Suspect During Arrest in a Brooklyn 'Target' ","<p>Police are shown kicking and kneeing&nbsp;a&nbsp;man they were arresting on&nbsp;trespassing charges.</p>","0.00","0.12","0.00","0.00","0.00","0.12","0.12","1","7"
"2072","/new-york/story/upper-west-side-morningside-heights/upper-west-side/board-of-affordable-housing-co-op-accused-of-using-building-as-piggy-bank/","20150727","3954","board-of-affordable-housing-co-op-accused-of-using-building-as-piggy-bank","635768","Board of Affordable Housing Co-Op Accused of Using Building as Piggy Bank","<p>Board members of a co-op on West 106th are accused of &quot;gross mismanagement.&quot;</p>","0.00","0.00","0.08","0.00","0.00","0.75","0.00","-1","7"
"2075","/new-york/features/get-out-do-this/14-things-do-this-week-new-york-citys-neighborhoods/","20150727","2451","14-things-do-this-week-new-york-citys-neighborhoods","641978","14 Things To Do This Week in New York City's Neighborhoods","<p>Open air jazz, open air movies, open air exercise, open air everything.</p>","0.00","0.23","0.04","0.04","0.15","0.05","0.00","1","1"
"2076","/new-york/story/williamsburg-greenpoint-bushwick/williamsburg/thief-hacks-down-25-foot-tree-steal-bike-locals-say/","20150727","2133","thief-hacks-down-25-foot-tree-steal-bike-locals-say","636642","Thief Hacks Down 25-Foot Tree to Steal Bike, Locals Say","<p>A thief cut down a tree in front of 242 Grand St.&nbsp;to steal a bike, locals say.</p>","0.00","0.24","0.11","0.01","0.03","0.24","0.24","-1","7"
"2077","/new-york/story/upper-west-side-morningside-heights/upper-west-side/widow-of-famed-magician-houdini-biographer-scammed-out-of-1m-court-docs/","20150727","2010","widow-of-famed-magician-houdini-biographer-scammed-out-of-1m-court-docs","636144","Widow of Famed Magician & Houdini Biographer Scammed Out of $1M: Court Docs","<p>Kin of Maurine Christopher say Santos and Jessica Molina claimed to care but were full of hocus pocus.</p>","0.00","0.19","0.05","0.14","0.00","0.00","0.00","-1","1"
"2078","/new-york/features/this-is-new-york/sleep-parked-van-for-22-night-with-these-airbnb-listings/","20150727","1763","sleep-parked-van-for-22-night-with-these-airbnb-listings","634784","Sleep in a Parked Van for $22 a Night with These Airbnb Listings","<p>Host Jonathan has about a half-dozen vans and campers around the neighborhood.</p>","0.00","0.00","0.09","0.09","0.00","0.00","0.00","-1","7"
"2080","/new-york/features/this-is-new-york/your-subway-rage-cant-faze-stand-clear-of-closing-doors-guy/","20150727","1513","your-subway-rage-cant-faze-stand-clear-of-closing-doors-guy","636611","Your Subway Rage Can't Faze the 'Stand Clear of the Closing Doors' Guy","<p>Charlie Pellett is the man whose voice you ignore on a daily basis.</p>","0.00","0.01","0.00","0.00","0.75","0.01","0.00","-1","4"
"2081","/new-york/story/east-village-lower-east-side/east-village/trash-vaudeville-leaving-st-marks-place-after-40-years/","20150728","8316","trash-vaudeville-leaving-st-marks-place-after-40-years","636823","Trash and Vaudeville Leaving St. Marks Place after 40 Years","<p>The punk rock clothier will move to Seventh Street, it told EV Grieve.</p>","0.00","0.00","0.38","0.06","0.10","0.00","0.10","-1","7"
"2082","/new-york/story/washington-heights-inwood/washington-heights/washington-heights-first-hotel-set-open-next-month/","20150728","7677","washington-heights-first-hotel-set-open-next-month","636671","Washington Heights' First Hotel Set to Open Next Month ","<p>The owner of Hotel Cliff on West 181st Street hopes to open in early August.</p>","0.00","0.04","0.00","0.00","0.00","0.08","0.00","-1","5"
"2084","/new-york/story/ditmas-park-flatbush/flatbush/video-police-punch-suspect-during-arrest-brooklyn-target/","20150728","3952","video-police-punch-suspect-during-arrest-brooklyn-target","636531","VIDEO: Police Punch Suspect During Arrest in a Brooklyn 'Target' ","<p>Police are shown kicking and kneeing&nbsp;a&nbsp;man they were arresting on&nbsp;trespassing charges.</p>","0.00","0.12","0.00","0.00","0.00","0.12","0.12","1","7"
"2085","/new-york/story/harlem/east-harlem/woman-beaten-with-brass-knuckles-for-disrespecting-attackers-mother-nypd/","20150728","3724","woman-beaten-with-brass-knuckles-for-disrespecting-attackers-mother-nypd","636534","Woman Beaten With Brass Knuckles for Disrespecting Attacker's Mother: NYPD","<p>The East Harlem woman was beaten outside the Wagner Houses on July 14.</p>","0.00","0.03","0.00","0.00","0.11","0.11","0.03","-1","7"
"2086","/new-york/story/williamsburg-greenpoint-bushwick/williamsburg/thief-hacks-down-25-foot-tree-steal-bike-locals-say/","20150728","3255","thief-hacks-down-25-foot-tree-steal-bike-locals-say","636642","Thief Hacks Down 25-Foot Tree to Steal Bike, Locals Say","<p>A thief cut down a tree in front of 242 Grand St.&nbsp;to steal a bike, locals say.</p>","0.00","0.24","0.11","0.01","0.03","0.24","0.24","-1","7"
"2087","/new-york/features/this-is-new-york/how-do-you-pronounce-waldbaums/","20150728","2276","how-do-you-pronounce-waldbaums","634858","VIDEO: How Do You Pronounce 'Waldbaum's'?","<p>&quot;<em>Wald</em>-baum&#39;s&quot;? <em>&quot;Wall</em>-baum&#39;s&quot;?&nbsp;&quot;Wah-bum&#39;s&quot;?</p>","0.00","0.04","0.00","0.00","0.00","0.00","0.00","-1","1"
"2089","/new-york/features/this-is-new-york/your-subway-rage-cant-faze-stand-clear-of-closing-doors-guy/","20150728","1821","your-subway-rage-cant-faze-stand-clear-of-closing-doors-guy","636611","Your Subway Rage Can't Faze the 'Stand Clear of the Closing Doors' Guy","<p>Charlie Pellett is the man whose voice you ignore on a daily basis.</p>","0.00","0.01","0.00","0.00","0.75","0.01","0.00","-1","4"
"2090","/new-york/story/east-village-lower-east-side/little-italy/new-arts-festival-highlight-street-art-lower-manhattan/","20150728","1768","new-arts-festival-highlight-street-art-lower-manhattan","636717","New Arts Festival to Highlight Street Art in Lower Manhattan","<p>The LoMan Arts Festival launches next week and will feature work by several artists.</p>","0.00","0.00","0.15","0.02","0.00","0.05","0.00","-1","7"
"2091","/new-york/story/washington-heights-inwood/washington-heights/video-owner-of-coogans-restaurant-fends-off-attack-from-homeless-man/","20150729","9899","video-owner-of-coogans-restaurant-fends-off-attack-from-homeless-man","637085","VIDEO: Owner of Coogan's Restaurant Fends Off Attack From Homeless Man","<p>Peter Walsh was attacked in front of Coogan&#39;s Restaurant on July 23, video shows.</p>","0.00","0.00","0.15","0.00","0.05","0.00","0.05","-1","7"
"2092","/new-york/story/murray-hill-gramercy-midtown-east/flatiron/shrink-persuaded-patient-start-live-in-romance-with-her-court-docs-say/","20150729","5002","shrink-persuaded-patient-start-live-in-romance-with-her-court-docs-say","636841","Shrink Persuaded Patient to Start Live-In Romance With Her, Court Docs Say","<p>Susan Turner moved into her patient&#39;s luxury pad and got her to change her will, court documents say.</p>","0.00","0.00","0.14","0.07","0.08","0.03","0.08","-1","7"
"2093","/new-york/features/apartmentality/these-boutique-businesses-help-city-families-flee-suburbs/","20150729","3521","these-boutique-businesses-help-city-families-flee-suburbs","636937","These Boutique Businesses Help City Families Flee to the Suburbs","<p>More city residents move to the &#39;burbs than vice versa and luxury firms are helping fuel the pipeline.</p>","0.00","0.23","0.06","0.06","0.10","0.00","0.10","1","1"
"2094","/new-york/story/east-village-lower-east-side/east-village/trash-vaudeville-leaving-st-marks-place-after-40-years/","20150729","3235","trash-vaudeville-leaving-st-marks-place-after-40-years","636823","Trash and Vaudeville Leaving St. Marks Place after 40 Years","<p>The punk rock clothier will move to Seventh Street, it told EV Grieve.</p>","0.00","0.00","0.38","0.06","0.10","0.00","0.10","-1","7"
"2095","/new-york/story/south-bronx/high-bridge/2-dead-31-sickened-by-legionnaires-disease-outbreak-south-bronx/","20150729","2579","2-dead-31-sickened-by-legionnaires-disease-outbreak-south-bronx","637269","2 Dead and 31 Sickened by Legionnaires' Disease Outbreak in South Bronx","<p>Since July 10, 31 cases of the illness have been reported in the South Bronx.</p>","0.00","0.05","0.75","0.75","0.03","0.00","0.60","-1","7"
"2096","/new-york/features/openings-closings/healthy-caribbean-food-spot-pick-eat-opens-inwood/","20150729","2465","healthy-caribbean-food-spot-pick-eat-opens-inwood","636957","Healthy Caribbean Food Spot Pick and Eat Opens in Inwood ","<p>The popular Washington Heights restaurant has a new outpost on West 207th Street.</p>","0.00","0.53","0.00","0.00","0.00","0.12","0.00","1","1"
"2097","/new-york/story/washington-heights-inwood/washington-heights/washington-heights-first-hotel-set-open-next-month/","20150729","2445","washington-heights-first-hotel-set-open-next-month","636671","Washington Heights' First Hotel Set to Open Next Month ","<p>The owner of Hotel Cliff on West 181st Street hopes to open in early August.</p>","0.00","0.04","0.00","0.00","0.00","0.08","0.00","-1","5"
"2098","/new-york/features/this-is-new-york/this-sing-along-will-restore-your-good-will-toward-your-fellow-new-yorkers/","20150729","2372","this-sing-along-will-restore-your-good-will-toward-your-fellow-new-yorkers","637208","This Sing-Along Will Restore Your Good Will Toward Your Fellow New Yorkers","<p>A group of strangers broke out in song&nbsp;on the R train Sunday night.</p>","0.00","0.75","0.10","0.10","0.00","0.10","0.09","1","1"
"2100","/new-york/story/murray-hill-gramercy-midtown-east/union-square/where-what-eat-during-restaurant-week/","20150729","2066","where-what-eat-during-restaurant-week","636975","Where and What to Eat During Restaurant Week","<p>Fixed-priced, three-course&nbsp;meals at neighborhood&nbsp;eateries are going&nbsp;for $25 to $38 for one week.</p>","0.00","0.05","0.15","0.00","0.00","0.00","0.00","-1","2"
"2101","/new-york/story/washington-heights-inwood/washington-heights/6-year-old-girl-who-survived-pit-bull-attack-dreams-of-becoming-vet/","20150730","62780","6-year-old-girl-who-survived-pit-bull-attack-dreams-of-becoming-vet","637288","6-Year-Old Girl Who Survived Pit Bull Attack Dreams of Becoming a Vet","<p>The girl was helping her grandmother do the laundry when she was bitten Tuesday night.</p>","0.00","0.00","0.12","0.09","0.05","0.06","0.05","-1","7"
"2102","/new-york/story/midtown-theater-district/midtown/plea-for-help-from-man-claiming-be-chinese-prisoner-found-saks-bag/","20150730","43444","plea-for-help-from-man-claiming-be-chinese-prisoner-found-saks-bag","506975","Plea for Help From Man Claiming to Be Chinese Prisoner Found in Saks Bag","<p>Stephanie Wilson discovered the letter in 2012. Now DNAinfo has found the man who said he wrote it.</p>","0.00","0.05","0.05","0.00","0.05","0.00","0.05","-1","7"
"2103","/new-york/features/get-out-do-this/14-things-do-manhattan-neighborhoods-this-weekend/","20150730","6349","14-things-do-manhattan-neighborhoods-this-weekend","643662","14 Things To Do In Manhattan Neighborhoods This Weekend","<p>This weekend&#39;s fun includes an ocean-themed carousel, fishing in the Hudson, and yoga in a mansion.</p>","0.00","0.75","0.04","0.04","0.04","0.04","0.00","1","1"
"2106","/new-york/story/washington-heights-inwood/washington-heights/video-owner-of-coogans-restaurant-fends-off-attack-from-homeless-man/","20150730","5675","video-owner-of-coogans-restaurant-fends-off-attack-from-homeless-man","637085","VIDEO: Owner of Coogan's Restaurant Fends Off Attack From Homeless Man","<p>Peter Walsh was attacked in front of Coogan&#39;s Restaurant on July 23, video shows.</p>","0.00","0.00","0.15","0.00","0.05","0.00","0.05","-1","7"
"2107","/new-york/story/crown-heights-prospect-heights-prospect-lefferts-gardens/prospect-heights/map-see-where-homes-sold-for-above-asking-price-manhattan-brooklyn/","20150730","5338","map-see-where-homes-sold-for-above-asking-price-manhattan-brooklyn","637410","MAP: See Where Homes Sold for Above Asking Price in Manhattan and Brooklyn","<p>Half of Brooklyn neighborhoods saw sales prices that were at or above asking prices, StreetEasy found.</p>","0.00","0.00","0.00","0.03","0.00","0.00","0.00","-1","7"
"2108","/new-york/features/this-is-new-york/video-men-react-footage-of-their-girlfriends-getting-catcalled/","20150730","5007","video-men-react-footage-of-their-girlfriends-getting-catcalled","637343","VIDEO: Men React To Their Girlfriends Getting Catcalled","<p>Surprise: they&#39;re outraged!</p>","0.00","0.11","0.00","0.00","0.75","0.00","0.75","-1","7"
